toxic_comment,neutral_comment1
"и,чё,блядь где этот херой был до этого со своими доказательствами?","Ну и где этот герой был,со своими доказательствами?"
"О, а есть деанон этого петуха?","О, а есть деанон"
гондон путинский он а не артист,"Человек Путина он, а не артист"
как урод такую херню пишет???,кто такую ерунду пишет
в гсвг за такие сапоги пиздюлей получил бы от сослуживцев,В ГСВГ за такие сапоги наказали бы сослуживцы
Спасибо! Потому что предвзятость модераторов начинает напрягать - модерируют как бык поссал.,Спасибо! Потому что предвзятость модераторов начинает раздражать-модерируют спустя рукава.
"слышишь тыпиздед! что то вы помощники россии не едите жить в деревню, а прёте в города!","Что же вы помощники России не едите жить в деревню, а все в городе едите?"
"ну и выродки,это твой ребёнок,зачем ты сучка рожала.","ну и люди,это твой ребёнок,зачем ты рожала."
позорник кадони поддержал зажравшегося меньщикова... без команды боится ребят поддержать и поставить придурка на место...,Кадони поддержал меньшикова. Без команды боится ребят поддержать и поставить его на место.
Почему у росгвардейца гибддшная палочка?,Почему у росгварлейца полицейский жезл?
мы всегда лучше вас жили и живём . черти вы ебанные . иди жопу мой ванючка,мы всегда лучше вас жили и живём
Не пытайся меня понять. Не напрягай свои зачатки интеллекта.,"Не пытайся меня понять, все равно не поймете"
"зато его урода лправдывают, а людей невиных гнобят.купленые и судьи и адвокаты.твари.","Зато его оправдывают ,а людей невинных обижают ,купленные судьи и адвокаты"
одного не пойму это насколько надо быть быдлом чтобы у стариков отбирать последнее и отправлять на грабленное домой.твари.,"Одного не пойму это насколько надо быть бесчеловечными,чтобы у стариков отбирать последнее и отправлять награбленное домой ,
.плохие люди"
биба и боба - два долбоёба! один снимает - другой погибает!,Два друга!один снимает другой погибает
"какая гадость... уничтожать на корню, эту заразу...","Какая гадость... уничтожать на корню, эту болезнь"
Сидела задумалась как заебала её эта никчёмная жизнь.,Сидела задумалась как надоела ей её эта жизнь.
"получается учитель тупой, исправленного отчества не существует! владиморович","Получается учитель не умный,исправленного отчества не существует!Владимирович"
"кто голосует за афганскую борзую ,вы ебанулись чтоль,пройдите в себе,знатоки породы,бляяяя","кто голосует за афганскую борзую ,пройдите в себе,знатоки породы"
", Если модеры сочтут удалить, да в чем проблема то?","Если модераторы решат удалить, да в чем проблема то?"
"хуй знает кто кум, но девушка красивая👍","Не знаем кто кум,но девушка красивая"
Только вот вся семья его живет в рашке и всех их перевезти не варик,Только вот вся семья его живёт в России и перевезти их всех не вариант.
не нравится сука???а что же ты народы стравливаешь мразь ???....,Не нравится? Что же ты народы ссоришь
да по хуй сука пол страны синька чемо.и не хуя молчат.одна кокая мразота известная пережрала водки так пиздец катострофа,"То что пол страны пьют-всем все равно, молчат. А как кто из знаменитостей напьётся-так катастрофу из этого делают."
этих сволочей надо расстрелять за жестокое обращение с животным!,Этих людей нужно наказывать за жестокое обращение с животными!
это как так же воспитывают что девочки уже трахаються во всю?) сильно слов нет,Это как так же воспитывают что девочки уже спят во всю? Сильно слов нет
ты чё пидор усатый против нас имеешь?,ты что против нас имеешь?
"хороших людей забирает, а хуйню оставляет, взяточников,","хороших людей забирает,а взяточников оставляет"
давно пора такой закон ввести. эта тварь отсидит и снова выйдет и снова будет с.....ка насиловать и убивать.,"Давно пора такой закон ввести, этот человек отсидит и снова возмется за старое"
шакалы. волк и то кости оставляет.,Волк и то кости оставляет
ебанутые савсем уже стали сосваим вирусом уже не знают че придумать. пердеть тоже корновирус.,Со своим вирусом уже не знают че придумать.Пукать тоже коронавирус.
ну и тварь эта гадина её покарает господь хороших родитетей тебе малышка🥰,Ее покарает господь. хороших родителей тебе малышка
да вообще похуй сколько этот долбоеб получает,да вообще все равно  сколько он получает
"все людей наебала ,а потом же , что бы деньги не отдавать , ты начинаешь хуйню писать !!","Всех людей обманула а потом же, чтобы деньги не отдавать, ты начинаешь чушь писать!!"
"вот из-за таких пидорасок,, простите девочки и,, семьи распадаются","Вот из-за таких, простите девочки и, семьи распадаются"
а сколько блядь они нам должны ни слова только мы им должны твари ненастные,"А сколько они нам должны ни слова только ,мы им должны"
и таких уродов не мало,таких много
б расстрел митинга в новочеркасске gать,расстрел митинга в новочеркасске
"он тащит электропоезд, а там контактной сети нет.дибил","Он тянет электропоезд, а там контактной сети нет."
да вот совсем насрать какая у него национельность,все равно какая у него национальность
без крыльев то какой мудак ездит!,без крыльев то кто ездит!
говорила ли эта мразь такие слова?,Говорила ли она такие слова
"у тебя что, ИНТОКСИКАЦИЯ УКРАИНСКИМ МИРОМ?",У тебя перенасыщение украинским миром
"блядь !!!полный беспредел ,прям в начале сезона,бомжы вы че совсем что ли прихуели!?!?!?!?","Полный беспредел, прямо в начале сезона, вы что совсем что-ли с ума сошли"
"Да хз, что ты до меня то докопался ?",да что ты до меня докопался?
"на хуя такое выкладывать, зто и дети будут смотреть долбоебы","Зачем такое выкладывать, это и дети будут смотреть"
правительство дешёвка коньченные 😡 жалко им детей накормить. зато сами жируют твари ебаные.,"Правительству жалко детей накормить, а сами зато на широкую ногу"
админы вы долбаебы как вы заебали плюсони плюсони на всякую хуйню,"Админы, вы уже надоели плюсони плюсони на всякую ерунду."
люди не в материться надо дох я русском языке других пездатых слов,"Люди, не надо материтьсяу нас так много красивых слов"
"какую хуйню вы порете с телеэкранов, вауу, это пиздец, чтобы в это верить нужно быть полным уебаном","Какую глупость вы говорите с телеэкранов, вауу, это надо же верить в такое"
путин пидар ебанный уходи в отставку.,Путин уходи в отставку
"так это у нас, будет, может быть, когда нибудь, вдруг. а ты вчера сосал, сегодня сосешь и завтра сосать будешь.","Так это у нас ,будет ,может быть ,когда-нибудь"
Студент с бабками - хуевый студент,Студент с деньгами-плохой студент
да ни у кого просто пиздобол.,"Да ни у кого,просто врёт"
порядок бы блять навёл !,Порядок бы навел
руки им оторвать за такой асфальт.,Наказать нужно за такой асфальт
у вас в деревне говнищи все такие политизированные? (h),У вас в деревне все такие политизированные?
"сколько вокруг гандонов пидорасов, узнаём только после","сколько вокруг нехороших людей, узнаем только после"
Спалил свой вк постя плохо закрашенную переписку.,Выдал свой вк постя плохо замаскированную переписку
тото ты и ебло своё прячеш для конфискацыи готовишся,ты и лицо свое прячешл для конфискации готовишься
а она блядь святая чаще пиздец,"А она святая, ну да."
да нахуй он кому нужен,Да зачем он кому-то нужен
дура без причины и понимать нечего,Без причины и понимать нечего
"мне и моим друзьям крым нужен. ну а пидорасов, согласен, не спросили.","мне и моим друзьям крым нужен, не у всех согласия спросили"
"Даже хохлы в гейропу не хотят, бабосы не те?","Даже украинцы в Европу не хотят ,деньги не те?"
"ну как бы..геи и пидорасы- как ни крути, выходят за рамки нормального","ну как бы..люди нетрадиционной ориентации- как ни крути, выходят за рамки нормального"
"может вы уже в личке решите,кто у кого отсосет и у какого осла,и кто пидар ,а кто нет.надоели😁😁😁","Может вы уже в личке решите, кто плохой человек, а кто нет"
я непоня а почему этому пидору по ибулу не дали,Почему этому человеку ничего не сделали
"они ждут только деньги, а за что им заплатят- им нет интереса. лишь бы бабло получить. падлы, предатели на овские.","Они ждут только денег, а за что им заплатят-им нет интереса, лишь бы деньги получить, предатели"
"ебанутые , посмотрите на украину.",посмотрите на украину
демократию Что ты об этом знаешь тупорылая пидораха?,Демократию.Что ты об этом знаешь?
черножопые охерели они и в германии себя чувствуют королями полный трындец а менты спасали свои жизни .,"Афроамериканци в Германии себя чувствуют королями, а полиция спасала свои жизни"
хуйня.... завдекаловка... потом увидите что на самом деле будет... как всегда обьебаловка народа,Потом увидите что будет. Как всегда народ обманут.
"И у меня гамно залежалось, тоже отправлю","и у меня кое-что задержалось, тоже отправлю"
"да его не то что уважать, его русские будут презирать, как последнюю гадину.","да его не то что уважать, его русские будут презирать"
какой пидор эту информацию выложил и зачем,Кто эту информацию выложил и зачем?
"пидорас ты сережа, раз такую хуйню прдлогаешь!!!","злой ты сережа, раз такое предлагаешь"
в глазах чужого государства они конечно красавцы!пидорасы кто россиянам поможет?,В глазах чужого государства они лучшие! Но кто поможет россиянам?
динамо на 3 забить а ты пидор все хорошо.,"Динамо на 3 забить , а ты все хорошо"
хорошо что не затаилась тварь,Хорошо что не затаилась создание
таких уродов нужно наказывать .,Такиз нужно наказывать
"Что, сцуко, характерно - сзади установлен реактор, появившийся на машине только во второй серии.","Что характерно- с зади установлен реактор, появившийся на машине только во второй серии"
"писатель хренов, ты сначала ефремова посади","Писатель, ты сначала ефремова посади"
"она самая прикрасная,очаровательное девочка. ни то что ходить по баром х...у сасать пивой запивать.ты умница девочка.","она самая прикрасная,очаровательное девочка. ни то что ходить по баром, ты умница девочка"
молодец женщина побольше бы таких умных и образованных а не тупое стадо носящий маски,"Молодец женщина побольше бы таких умных и образованных,а не таких ненормальных"
ни хрена себе! я и не знал что этой жабе при жизни памятник поставили... неужели - насосала?,я и не знал что этой женщине при жизни памятник поставили...
нет ничего хуже чем увидетb мразь в человеке готорого ты считал лучшим,Нет ничего хуже чем увидеть плохое в человеке которого ты считал лучшим
Вы что дебил? Кто же будет исследовать собственные косяки? В лучшем случае предлжат усовершенствованную вакцину позже.,Вы чего не понимаете? Кто будет исследовать собственные косяки? В лучшем случае сделают вакцину лучше.
ты мразь почему стыдишься русского языка ??,почему вы стыдиться русского языка?
"мусора демократизаторами отхуярят так, что забудешь, как жаловаться.😃","Полицейские демократизаторами сделают так,что забудешь,как жаловаться"
"базара нет... если пидоры у власти, значит жди в стране напасти!!!","Если плохие люди у власти, значит жди в стране напасти"
"респект батьке. давить орущих, а тех к с коктейлями молотова сажать на долго.","Молодец,батька. Тех кто с коктелями молотов сажать надолго"
"вам, пидорасам госдеповским, по штату не положено.","вам,по штату не положено"
Малюй на СВО М холсте а не на стенах домов. Лишь бы политоту приплести.,Рисуй на своём холсте а не на стенах домов.лишь бы политику приплести
так на данный момент выигрывает и ебёт эту четвёрку пиндосовскую в хвост и гриву!!!,Так на данный момент выигрывает у этой четвёрки американской с большим запасом!!!
Ну есть её фото? Мне голос её всегда напоминает ту ведущую с россии1 на которую дрочат крым-политачеры.,Ну есть её фото? Мне её голос напоминает ТЦ ведущую с России 1.
этих блядей российское телевидение пиарит. когда уже «звездопад» начнётся? девицы легкого поведения звёздами становятся на раз два!,Этих девушек российское телевидение пиарит. Когда уже «звездопад» начнется? Они звёздами становятся на раз два!
"долбоебам уазик достался , машина классная и простая в обслуге !","Им УАЗик достался,машина классная и простая в обслуге!"
в девяностые этот перекормленный молодняк жрал бы голубей..видно сказок пиндосни наслушались про счастливое прошлое..,"В девяностые этот перекормленый молодняк ел бы голубей, видно сказок наслушались про счастливое прошлое"
ну да жена на работе ебашит а он из чужой пизды не вылазит охуенно живём,Хорошо живём жена целый день на работе а муж на стороне
"Ну что, сломал ваш косоглазый карточку походу. Теперь будете на новую собирать.","Ну что, сломал он карточку походу.теперь будете на новую собирать"
вся россия хочет этого упыря в отставку,Вся Россия хочет этого в отставку
пиздюлей этому подростку надо дать таких чтобы запомнил на всю жизнь,"этому подростку надо так объяснить, чтобы запомнил на всю жизнь"
"кому она абосралась твоя вакцина, засунь себе её в жопу!","Кому она нужна, твоя вакцина?"
сам долбоеб и окружает себя такими же долбоебами,"сам не очень умный,и такими же себя окружает"
"дрянь, ещё оставила его лежать, сука","жестокая, ещё оставила его лежать"
"ты у меня сможешь только отсосать гомик ебучий, иди просто на хуй.",Отстань от меня.
"что за очередная хрень😂пускай в африку еще напишут послание,дебилы помешаные,бля,какк будто больше делать не хрен в этлй жизни😁","что за очередная ерунда😂пускай в африку еще напишут послание,как будто больше делать не чего в этой жизни😁"
"ты,педрило,очень скоро пойдешь на зону и тебя будут иметь самые немытые зеки!","Ты скоро пойдёшь в тюрьму, и тебе там будет плохо."
абу ебаный угомони своих кудрявых друзей или бунт поднимем,Ты угономи своих друзей или бунт поднимем
это полководцы у нас такие суки роту загубили,"Это полководцы у нас такие , роту загубили"
нахрена этого придурка клоуна сюда впихивают?,Зачем его сюда впихивают?
тебя не научили родину любить малоетняя дурочка,Тебя не научили родину любить?
"сериал просто пиздец, других слов нет. глянь. лично мне прочно въелся в душу.","Сериал хороший, других слов нет, глянь, лично мне прочно в душу въелся."
ты хоть слова меняй хуйло одноклеточное. одну и ту же хуйню кукарекаешь.,ты хоть слова меняй. одно и то же говоришь.
"тоже так думаю. честн- ёбань. не понимаю , кто так пишет. честно- пидарас",Тоже так думаю. Не понимаю кто так пишет
"ожиревшее, охуевший ,тупое мурло. догадаетесь, чьи помыслы они вещают. правильно , пыни батюшки.","Догадаетесь, чьи мысли они вещают. Правильно. Пыни батюшки"
заебали этой хуйнёй. неужели больше нечем заняться?,Неужели больше нечем заняться?
это люди которых дрочили в детстве чморили а теперь они вот так отрываются пида.... сы,"Это люди, которых обижали в детстве и теперь они отрываются"
