toxic_comment,neutral_comment1
таких музыкантов нужно отстреливать .,Таких музыкантов нужно наказывать
"идите на хуй, со своей вакциной, ебанутые!!!",Оставьте меня в покое со своей вакциной
ссыт за свою жопу интриган.,боится за себя
да отмажется падла.мужика жалко еще весь мозг выедят дятлы.,"Да отмажется, мужика жалко"
этих уродов пора в магадан,этих товарищей пора в магадан
"они не понимают, одноразовые вы менты, вы ему не нужны когда вас будут судить, поймите пидоры","Они не понимают, вы ему не нужны когда вас будут судить"
это ты мне чурек ?,Это ты мне?
вот сволочь!да чтоб ему аукнулся этот благородный поступок!,да чтоб ему аукнулся этот благородный поступок!
"коментировать нечего просто простите за выражение сука,","коментировать нечего просто простите за выражение,"
уебаны вы че оболдели какая вакцина. по мозгам ехать нефег. вам воткнуть надо чтобы на простых людей миллионы не заработали,"вы че оболдели, какая вакцина. по мозгам ехать не надо. вас нужно наказать, чтобы на простых людей миллионы не заработали"
сульщер всё равно не тот тренер для мю. решающих играх он всё просрал урод. я это и раньше говорил.,"Сульшер все равно не тот тренер для мю. В решающих играх он все проиграл ,я это и раньше говорил"
просто козлина какой-то больше не чево на писать нормальные люди так не поступают это чмо козёл и хомло.👎👎👎👎,"Это не хороший человек, пишет только плохое.Нормальные люди так не поступают"
ну прошу пидорасы в омона менты спецназ кто против меня,"Ну прошу люди, в омона менты спецназ, кто против меня"
скоро всем этим крысами будет пизда!!!!!!!,Скоро всем им будет конец
"что за дебилы такое сочиняют. вы только задумайтесь, губернатор и государственный долг.","Кто это сочиняет. вы только задумайтесь, губернатор и государственный долг."
под этим фото пидар сидит тащится от лайков,Под этим фото сидит тащится от лайков
а ведь двойник он падла !!!!!!!!,А ведь двойник он!!!!
да сам ты такой вот и всё. чмырь оборзевший! обрывается он)),Ты сам такой
"действительно дибилойды , бабулю чуть до инфаркта не довели",Бабулю чуть до инфаркта не довели
"люда ты еб-нутая что ли, тебе одно, а ты в залупу, случаем не мама ты энтого ублюдка.","Люда, ты совсем что ли тебе одно а ты о другом , случаем не Мама ты этого человека"
"ещё бы мешок картошки оттуда вытащил, есть же долбаебы.",ещё бы мешок картошки оттуда вытащил
"согласна, эту рыжую свинью на кол. расстрел для него слишком гуманно. только не понятно почему он руководит таким значимым предприятием?!","Согласна. Расстрел для него слишком гуманно. Только не понятно, почему он руководит таким значимым предприятием?!"
не кукла а мумия молью трахнутая,"Не кукла, а мумия плохого качества."
таким чертям не место среди нас всю семейку надо уничтожит тварей опозоривших наших отцов и дедов,Таким людям не место среди нас всю семейку опозоривших наших отцов и дедов
"а-а-а-а, точно. он тоже пидорастов мочил.","А-а-а-а-а, точно он тоже их бил"
"до полтинник дожил, ума ни хуя, дебил! :d",До полтинник дожил ума нет
это дебилы отстой общества их нужно истреблять,Эти люди недостойны общества
да как носит таких козлов на земле.,Да как носит таких людей на земле
"долбаебы,переведите на наше время.ска ,кто согласится такие посты,такое ощущение,что страна ждала героев,пизда рожала дураков.","Плохие люди. Переведите на наше время. Страна ждала героев, а сделали плохих людей."
до чего же глупая эта власть!не поздно ли спохватились менять кадры!!!глупые циркачи!!!клоуны затейники покиньте пост свой не позорьтесь!!!,До чего же глупая власть! Не поздно ли спохватились менять кадры!
"нет! больно когда хочеш чтоб забрало ,а оно сука не забирает.","нет! больно когда хочеш чтоб забрало,а оно не забирает"
"слушвй хохляра, вы проебали украину, а теперь ты обвиняешь всех и вся.","Слушай, вы потеряли украину, а теперь ты обвиняешь всех и вся"
"ты это скажи о высоцком, ублюдок !",ты это скажи о высоцком!
"Я же не мразь, лжец, приспособленец и просто негодяй.","Я же не лжец,приспособленец и просто негодяй"
"болтун! пусть едет в хабаровск, замутил воду, дрянь! вместе с зюгановым!","болтун! пусть едет в хабаровск, замутил воду! вместе с зюгановым"
"слишком много их тварей чтобы всех знать в лицо, из-за них и сидим без работы и уже начинаем голодать","Слишком много их, чтобы всех знать в лицо, из за них и сидим без работы и уже начинаем голодать"
хоть бы раз суки показали по телевизору правду,Хоть бы раз показали по телевизору правду
когда же в россии все проснутся?или так и будем рабами пидарасов,Когда же в России все проснутся? Мы должны быть самодостаточными
"это укрожопые хохлодебилы , уже 6 лет слюнями брызгают -конец рашки , а он никак не наступает.","Украинцы уже 6 лет говорят, что России конец, а он никак не наступает."
"C хуев они отказались от эксклюзивов? Форза, Хало, Гири-это эксклюзивы винды, хуй ты их на плойке запустишь","Почему они отказались от эксклюзивов? Forza, Halo. Gears of War - эксклюзивы Windows, которые нельзя запустить на Playstation"
"бляя, не огорчай меня. получается тоже? 🐔",Не огорчай меня. Получается тоже?
"Сука, по монитору стекает, опять за тряпкой идти","По монитору стекает, опять за тряпкой идти"
"Ха ха, пиздос. Там в комментах ещё либерасня подпиздывает. Поколение, воспитанное женщинами","Ха,ха. Там в комментах ещё либералы высказываются. Поколение, воспитанное женщинами."
козел. это же и дети увидят. и его дети в том числе. вырастут такими же ублюдами.,Это же и дети увидят. И его дети в том числе. Вырастут такими же неправильными
всех в магодан лес валить мрази,Всех в магодан лес валить.
"даже суки не посмотрели в сторону пострадавшего бмв,как так и надо.у бумера сработали подушки, водиле по ходу не хило досталось.","даже не посмотрели в сторону пострадавшего бмв. У бумера сработали подушки, водителю вероятно досталось."
"Ахах, чувак. Скажи, что пошутил неудачно, иначе это пиздец.","Ахах, скажи, что пошутил неудачно, иначе это конец"
что за идиоты выкладывают это говно.,Что за люди выкладывают эту ерунду
никому не нужны чужие выблядки.,Никому не нужны чужие дети.
"Маловато этих мымр гнобят. Они на очередных выборах опять подмахнут, кому надо.","Мало их унижают. Они на очередных выборах опять подмахнут, кому надо."
"уебок, но поет не плохо.",поет не плохо.
ты дурак? беларусы до сих пор тратят те доллары коротые заработали в начале 90!ты пиздолиз !,беларусы до сих пор тратят те доллары коротые заработали в начале 90
соловей как истинный жидяра делает жидовскую работу - разделяй и властвуй.,соловей делает работу - разделяй и властвуй
сволочь конченная. мразь как ты будешь людям в глаза смотреть? народ ненавидит тебя.тебе это так не пройдет.,Как ты будешь людям в глаз смотреть? Народ не любит тебя. Тебе это так не пройдёт
сука так пиздеть не в первой!!!,так врать не в первой
так или иначе его настигнет божья кара всю жизнь трясись сука!,Так или иначе его настигнет божья кара всю жизнь трясись!
80% нахуя так пафосно? смешно бля.,зачем так пафосно? смешно
а сколько ещё этот пидор закопал вокруг дома😂,А сколько ещё этот человек закопал вокруг дома?
разводят людей....даже особо не заморачиваются...а это вообще реально выглядит или нет? им посрать....пиздят как дышат....,Разводят людей...даже особо не заморрачиваются...а это вообще реально выглядит или нет?им все равно...врут как дышат
"здесь были два пидара , вова и дима",Здесь были вова и Дима
этого уебка под суд......без коментов,Этого под суд......без коментов
"ну и где в байконуре лес, дебилы",Ну и где на Байконуре лес
"вв пидары живёте в россии, к российским мусарам запишите подобное видео. или не разрешают?","вы живёте в России, запишите подобное видео к российской милиции или не разрешают?"
"да милое фото, но сколько долбаебов, пиздастрадальцев, фейк это мужики.",Хорошее фото но это фейк
"ну если ездить таким ебанутым способом, то да нужен задний привод... :)",Ну если ездить таким способом то да нужен задний привод
"да это пидор(прошу прощения за выражение)но других слов у меня нет,скорее всего у него в детстве такое же было",Да это плохой человек но других слов у меня нет. Скорее всего у него в детстве такое же было
если это правда то путин молодец ! бойтесь его суки.!,"Если это правда, то Путин молодец, бойтесь его!"
"какой автоприцел,ручками нацелился и ебнул и откатился если что","Какой автоприцеп, можно приноровиться и откатить руками"
"ЧЕТВЕРГ РЫБНЫЙ ДЕНЬ ПРИШ Л В СТОЛОВУЮ ПУСТЫЕ ПРИЛАВКИ Не понял, можно поподробней?","Четверг - рыбный день. Пришёл в столовую, прилавки пусты. Не понял, можно поподробней?"
"Ок, при чем здесь мы-то, дурачок? Переживаешь за хохлов, получай их громадство, голосуй за кого хочешь.","Ок. При чем здесь мы? Переживаешь за украинцев, получай их гражданство, голосуй за кого хочешь."
"мразь это та тварь , которая лезет к нам в россию со своей молитвой","Плохой человек это тот, который лезет к нам в Россию со своей молитвой."
время бежит время мчится время скачет кто не пьёт да не ебёт потом вспохватится,"Время бежит, время мчится, время скачет, кто не пьёт, тот потом вспохватится"
И тогда бабка начнет ебать мозги еще и соседям. Гениально.,И тогда бабка начнет беспокоить еще и соседей. Гениально.
"долбаебы, сначала развязку в тольяти постройте.а потом уж о пробках на гес говарите","Сначала развязку в Тольятти постройте, а потом уж о пробках говорите."
что за пидор выкладывает такие картинки ???,кто выкладывает такие картинки
"мужиков то нет ,одни папорацы ,да пидоры.",Мужиков нет
"эти ублюдки в своей стране порядок навести не могут, но в любую задницу норовят заглянуть","В своей стране порядок навести не могут, а к чужому норовят заглянуть"
такое дер..мо не тратьте продукты,"такая гадость, не тратьте продукты"
когдть же этот уёбок пойдёт гулять по мосту.,Когда же этот человек пойдет гулять по мосту
пидор ты гнойный сидиш за границей и мутиш народ козлина ваша демократия нам не к чему,Живешь ты за границей и мутишь народ. Ваша демократия нам не к чему.
пиздешь! развод для лохов которые классы ставят.,Враньё!развод для глупых которые классы ставят.
у них было оружие пристрелии бы зачем выпендриваться,У них было оружие. Могли бы им воспользоваться.
пусть на хуй что хотят делают суки зайбали поедим домой,Пусть делают что хотят. Поехали домой
"пиздец стране ! гражданская война , кровь , смерть , горе , разруха гарантированы .",Гражданская война и горе гарантированы стране.
дерьмо к дерьму не пристанет,Плохое к плохому не пристанет
хабаровск вы ебнутые! вы за кого вступаетесь! за убийцу! вы че все об угол ебанулись?!,Хабаровск! Вы заступаетесь за убийцу!
Уточняю- ощущение такое что ты блеванул на клавиатуру.,"Уточняю - ощущение, что ты испортил клавиатуру"
как эта сука боится суда,Он боится суда
ни одного положительного отзыва)))) казел обоссаный!!!,Ни одного положительного отзыва
пи вот пидорасы же как чего спиздят обязательно медведя нарисуют с,"Вот недостойные люди. Если что-то своруют, обязательно нарисуют медведя"
точно козел. как только рука поднялась. чтоб ему пусто было!!!,как только рука поднялась. чтоб ему пусто было
кого ебёт что ты любишь ишак?,Кого волнует что ты любишь?
ну почему же не услышали??? за это его и трахнули в задницу... он же этого хотел??,Ну почему же не услышали? За это его и наказали...он же этого хотел
"пиздец подкрадывается к вам незаметно, братья белоруссы.",Пипец подкрался к вам незаметно братья беларуссы.
"если один мальчик смог развалить страну, то значит не страна была, а кучка из говна и палок.","Если один мальчик смог развалить страну, то там и без этого все не ахти было."
а что ты мальчишек отчитываешь? ты свой фейс покажи.описалась ? а им приказали .курица.,А что ты мальчишек отчитываешь? Ты свое лицо покажи. Испугалась? А им приказали.
"оторвать бы руки такому слесарю, который разметку на металле делает маркером!!!","Плохой слесарь, если разметку на металле делает маркером!!!"
"пидор, ты кого видел? какую собаку , ибанат ты тупой, ахаахаа,ту собаку которая твою старухумать драла как казу , ахааа",ты кого видел? какую собаку?
эй пид..ор у них государственный язык украинский,У них государственный язык украинский
"Ахуеть, а ты откуда знаешь!!!?!??",А ты откуда знаешь?
"как можно жить, жрать и ..., зная, что тебя ненавидит весь людс кой мир, сдохни, тварь !!!","Как можно жить, питаться и спать, зная, что тебя ненавидит весь людской мир.?"
"ты дура долбаная, с начала думай если есть чем ,а потом пиши.","Сначала подумай, а потом пиши."
"Это же пизда будет объебосы сразу вмякие повылазят, будут шастать по улицам, повысится криминал, дтп и всякая другая хуйня","Это плохо будет сразу всякие повылазят, будут шастать по улицам, повысится криминал, дтп и всякая другая ситуация"
ВО во письмо наверняка хохлы не нравятся видите ли не нравится им руководство части ууух суки,"вот письмо, наверное украинцы не нравятся, видите ли не нравится им руководство части"
У петушков в телевизоре куда ни плюнь - всюду провокации.,В телевизоре куда ни плюнь-всюду провакации.
пёс молодец а хозяина машины уебать по яйцам надо за плохое отношение к овчарке,"пес молодец, а хозяина надо наказать за плохое отношение к овчарке"
"Опущ, ты везде багорт видишь?",Ты везде багорик видишь?
"идите нах со своими масками , в жопу себе их засуньте",да ну вас со своими масками
прихуйздатый расшифровку придумать не могу,Не могу придумать расшифровку
хорош пиздить фотки с багини,Хватит воровать фотки с багини
Ей и электрошокер в яйца был похрену. Я думаю она бешенством болела.,"Ей и электрошокер был нипочём. Я думаю, она бешенством болела"
"Ну не хочешь - ну донать, лол. Зачем кукарекать-то как петух токсичный?",Ну не хочешь - плати! Чего кричать- то?
"интересно как этот попал в депутаты, я все больше убеждаюсь теперь в думе одни идиоты",Интересно как он попал в депутаты?
"а его место на виселицу, в таком случае, за такие слова.",А его нужно наказать за такие слова
я тебе сука сарай приготовил,Я тебе сарай приготовил
блядь это он кому сказал пиндосы?,Интересно кому он это адресовал ?
идиоты.. давайте своих имбецилов. не трогайте святое!!!!,Давайте своих! Не трогайте святое!
"чтобы было монго, много денег а х.... и у мертвого отсосут!",Чтобы было много-много денег. А ради этого сделают всë.
таких нада любить трахать женщин,таких нада любить
"предлагаю начать с госдумы, сжечь их нахуй!",Предлагаю начать с госдумы
"выбросить из думы как кота позорного, с формулировкой- в связи с утратой доверия. ну или просто трахнуть за горожами.","убрать из думы, с формулировкой- в связи с утратой доверия."
на пируется на трахается и придет,Напируется и приедет
"долбоеб, ум отсутствует, на его роже написано, дурак!","Ум отсутствует, на его лице написано, глупый!"
