toxic_comment,neutral_comment1
"бля,ну макусик,тебя только заебала((((( наверное о:","Ну макусик, тебя только достала((( наверное"
"СВОЛОЧЬ Я ХОЧУ ПРОСНУТЬСЯ И УВИДЕТЬ ЧТО ТЫ ЧИТАЕШЬ МЕНЯ,НО ЭТОМУ НЕ БЫТЬ :С ОБИДНО И БОЛЬНО :С Я ПЛАЧУ :(((","Я ХОЧУ ПРОСНУТЬСЯ И УВИДЕТЬ ЧТО ТЫ ЧИТАЕШЬ МЕНЯ,НО ЭТОМУ НЕ Быть, ОБИДНО и Больно, Я ПЛАЧУ"
"Что за дибилы голосуют, как можно было выгнать Тину?((","Кто так голосует, как можно было выгнать Тину?"
я сиводня падскальзнулся и ебнулся(((((((((,я сиводня падскальзнулся и упал(((((((((
"заибись  Максим меня виноватой считает , охуеть не встать ! :(","зашибись,  Максим меня виноватой считает офигеть не встать !"
А ведь действительно херова когда не понимаешь математику:|,А ведь действительно ужасно когда не понимаешь математику
"Бляя, уснул в 20 00, пиздаа :( теперь не уснуть всю ночь",Уснул в 20. Теперь не усну всю ночь
"У кого то один хуй никаких принципов, делает не то что говорит(((","У кого-то никаких принципов , делает не то , что говорит"
"Так всегда... Ты веришь, а тебя наёбывают(","Так всегда. Ты веришь,а тебя обманывают"
"вот блять!сегодня же тоже придется убираться в комнате.и тут фраза ""МАМА НЕ ТРОГАЙ ЭТО!ЗДЕСЬ ВСЕ ПО ФЭНШУЮ"" уже не прокатит:::(","Сегодня тоже придётся убираться в комнате и тут фраза мама не трогай это, здесь все по фэншую уже не прокатит"
"Ебать малая на утренике заплакала ,а ведущий виноват , что за пиздец?(","Малая на утренике заплакала,а ведущий виноват,чего это?"
"Поставила на балл ниже по географии. Сука, я всю перемену учила! :(",Поставила на балл ниже по географии. Я её всю перемену учила
"Я КАК КИМ ДЖОНГХЁН, БЛЯТЬ. КОРОТЫШКА ПО ЖИЗНИ((((((((((((","Я как Ким Джонгхен, вообще, коротышка по жизни(((((((((("
"ебать щас я вообще растроился, аж все делать перехотелось(((((((((((((((((((((((((((","Щас я вообще расстроился, аж все делать перехотелось"
ну сейчас будет очень хуёво( мне будут давать пизды за прогулы,"Ну сейчас будет очень плохо, меня будут ругать за прогулы"
МЫ УВИДИМСЯ ЗАВТРААААА ЕЕЕЙ ( ну скорее всего,мы увидимся завтра скорее всего
"бля, страницу удалил, теперь стопроц настя звонить будет или смски писать.всегда так. сначала творит хуйню, а потом БЛИН НУ Я НЕ ХОТЕЛА(((","Страницу удалил,теперь стопроц настя звонить будет или смски писать.всегда так.сначала начудит,а потом НУ Я НЕ ХОТЕЛА((("
"до стипендии не хватает 0,07... это называется: ахуеть, какой пиздец(((","до стипендии не хватает 0,07... это называется: безвыходная ситуация"
Пиздец сижу в подезде жду пока мама приедет с работы (,Сижу в подъезде жду пока мама приедет с работы
"еб нах кароче , досмотрела отбросы последний сезон ((( ищу что дальше смотреть",Досмотрела отбросы последний сезон ищу что дальше смотреть
я по вам тут скучал бля говорю доброе утро а вы мне тут головой ток киваете(((0 ОП вы пидор,Я вам говорю доброе утро что скучаю а вы мне только головой киваете
"вы не цените мой музыкальный вкус, гондоны :(",Вы не цените мой музыкальный вкус:(
Как я мог ее ПРОЕБАТЬ!(,Как я мог её потерять
"постригусь под каре!!!!!но... хуй мне, я кудрявая жопа(","Постригусь под каре!!!! Но как ,я ведь кудрявая"
"Встретила свою знакомую(  Какой кошмар, это просто пиздец!!!!!",Встретила свою знакомую. Какой кошмар
Яна пиздец как устала(,Яна очень устала.
Так обидно..неужели всем парням нужны только выебистые красивые суки...а что же делать милым наивным и добрым девочкам?((((,"Так обидно, неужели всем парням нужны только красивые девушки, а не милые и добрые?"
Из-за меня Соня может получить пизды(,Из-за меня Соне может достаться
о блять еще круче меня теперь читают ток 20 людей((,у меня теперь аудитория только двадцать человек осталась
"Бля завтра ссаный экзамен.Очкую,пиздец,ибо если не сдам батя секатором пальцы пооткусывает(",Завтра экзамен. Очень боюсь ибо если не сдам Папа разозлится
"Пиздос, Диана начала смотреть их :(","Ужас, Диана начала их смотреть"
хуйня коллаж у меня ;(,У меня плохой коллаж
и вот эту хуйню мне надо пить 3 дня((,И вот это мне нужно пить 3 дня
"какой нахуй сочинение, надо дипломную писать(","какое сочинение, надо дипломную писать("
аааа как жаль:( Эта дура нас обогнала!(,аааа как жаль:( она нас обогнала!(
"это первый на моей памяти год, когда весь пиздец и сразу наваливается(","это первый на моей памяти год, когда всё и сразу наваливается"
Скотина!! ты меня тупо игноришь*(((я тебя ненавижу!!!... и люблю больше всех...,Ты меня игноришь(((я тебя ненавижу!!!... и люблю больше всех...
"заебал этот сони вегас,нихуя не хочет работать(","Надоел этот сони вегас, не хочет работать("
ты меня специально пробелами троллишь чтоли сук(,ты меня специально пробелами троллишь чтоли(
Этот мудак испортил мое офигенское настроение:(,Плохой человек испортил мое прекрасное настроение
НА НГ ХАТА ЕСТЬ ВСЁ В НОРМЕТОКА ОСТАЛОСЬ ОДНА ПРОБЛЕМА (,"На НГ есть комната всё в норме, осталась одна проблема ("
за окном светит луна... или какой то пидарас с фанариком лазает?о_О,За окном светит луна... Или кто-то с фонариком лазает?
да ебать хуль весь день делать:(,да а что весь день делать:(
ленивые уроды( бросили меня одну,ленивые люди. Бросили меня одну
Последняя неделя. Оценки пиздец:(,Последняя неделя. Оценки плохие(
"пиздишь же, зачем ты так врешь его друзьям((((",Зачем ты так врешь его друзьям?
"Вобще лох я,плавать не умею нехера ,в шоке от результатов((","Вообще я плавать не умею, в шоке от результатов"
"Пиздец... Настроения нихуя, работать ни хочу... Нихуя не слышно... Пиздец в общем:(","Настроения нет,работать не хочу... ничего не слышно...кошмар в общем ("
"Бля,да че так скучно то?Без молодежки нечего делать.(Ебать скоро НГ а как то похуй","Почему так скучно? Без молодёжки нечего делать. Скоро Новый год, но как-то всё равно"
погода со всем в край ебанулась(,погода совсем испортилась
БЫТЬ ОДИНОКИМ ХУЙЛОМПлюсы:+ Тебя никто не может бросить!Минусы:– Ты никого не можешь бросить. :(,Быть одиноким . Плюсы:тебя никто не может бросить .Минусы:ты никого не можешь бросить.
Дневники вампира такая хуйня. Как вы смотрите?((,Дневники вампира такая ерунда. Как вы смотрите?
пиздеец((( малышка,Ужас((( малышка
пиздец ваше(( такой геморрой с этими телефонами !(,такой сложно с этими телефонами !(
"Сидеть три пары и слушать какой я дебил,чё не сделаешь ради ебаного зачета(","Сидеть три пары и слушать о себе всякое, чего не сделаешь ради зачета..."
"просто... Да, я мудак, извини(((","Просто да, я плохой, извини"
"БЛ,как я без плеера??? -_- завтра в поезде я просто укисну нах!(((((((ибо он,тварь подлая,не заряжается почему-то...&gt;&lt;","Как я без плеера? Завтра в поезде просто укисну, ибо он не заряжается почему-то"
пиздец ребят обоссалась во время зачёта(((((,"Ребят, обоссалась во время зачёта (((("
"суканахуй, чо и правда за хуйня, чо он мне контакт не грууузит((","Что за ерунда, что он мне контакт не грузит((("
Бля опять ногу въебал обидно пиздец на этот раз не связки но все равно болит(,"Черт, опять ногу повредил, обидно жутко, на этот раз не связки, но все равно болит..."
"блять ты гонишь или что? наверное думала что будем общаться,как ты думаешь?! :|",Наверное думала что будем общаться!
Да вот не интересно так вообще . Ненавижу тебя ! Пришел ушел !Как я начала ! Пиздец !Бесишь !Аа:(,Да вот не интересно так вообще. Пришел ушел !Как я начала ! Аа:(
скачал будильник пока настраивал уснул((( пизда проспал всё нахуй,Скачал будильник пока настраивал уснул(( всё проспал
Сука! Я тупая! Не могу сброс настроен сделать(((,Какая я глупая! Не могу сброс настроек сделать
"Говоришь,что тебе похуй на него; а у самой слёзы на глазах=(","Говоришь что тебе всё равно на него, а у самой слезы"
"Блядь, как же я заебалась с поисками квартиры! Я так хочу уже иметь свое жилье(( Сука, как заноза в жопе эти поиски",Как же я устала искать квартиру! Я так хочу иметь уже свое жильё. Как груз на шее эти поиски.
"заебалась уже, а ещё нужно биологи и английский делать(","Устала уже,а ещё биологию и английский делать("
"Все, лента, я вас любил, но походу мне пизда((","Вся лента, я вас любил, но мне конец"
"Хаха,блядь это пиздец  выгнали с класса а меня нет!:(","Хаха,  выгнали с класса а меня нет!:("
пиздец в шк в падлу идти :(,В школу лень идти
"вторая физика больше меня не радует, иди нахуй простр :-(",ВтораЯ физика больше мен не радует
"пиздец какой грустный котик,(",Какой грустный котик (
"Недавно выла от одиночества, а теперь ГОСПОДИ ИЗБАВЬ МЕНЯ ОТ ВСЕХ ЭТИХ ПРИДУРКОВ!((((","Недавно выла от одиночества, а теперь господи избавь меня от всех этих."
БЛЯТЬ((( ЧУВАК НЕ РАСКИСАЙ!!!! ОН НАВЕРНЯКА ПОПАДЕТ НА ХОМЯЧИЙ ЧЕРНЫЙ ПАРАД!!!,Не грусти.ОН НАВЕРНЯКА ПОПАДЕТ НА ХОМЯЧИЙ ЧЕРНЫЙ ПАРАД!!!
"Вы, козлы, вы почему постоянно цепляетесь к словам? Я же расстраиваюсь:(",вы почему постоянно цепляетесь к словам? Я же расстраиваюсь
"Поскрывали,  сучки, свой твиттер.   Так не честно:-(",Скрыли свой твиттер. Так не честно.
я все еще жду сообщение от одного пидара :(((((((((((,Я все ещё жду сообщение от одного индивидуума
Сука в кс го меня опять оштрафовали на 7 дней сука!((,в кс го меня опять оштрафовали на 7 дней!((
просто они меня бесят. Пиздец как...,просто они меня бесят
ясен хуй плакать будет. (,плакать будет.
"уроды вообще((( люди голосовали за серегу,а не за скородумову(((",Люди голосовали за Серёжу а не за скородумову
"Сукааа, блять где Версус то???? Чё за нахуй?((( спать уже охота блять!!!!( Чё внатуре мозги то ебать?",где Версус то???? Что это такое?((( спать уже охота!!!!( Что за дела???
этот пидорас звонит и молчит(((только сексуально покашлял мнеа так я сама с собой болтала,"Звонит и молчит , только покашлял, сама с собой поговорила"
блядь я не помню(( ахах,Я не помню
"дай мне свой номер, падла или заметь меня уже :-((",Дай мне свой номер или заметь меня уже :-((
реальный пиздец. И часто так бывает?(,Караул... И часто так бывает?
"Воронина, сцук, я и так постоянно пишу хуйню :(:(:(","Воронина, я и так постоянно пишу глупости"
"Данил извращенец тупой, взял поднял на льду и вместе упали.больно(",Данил поднял на льду и мы вместе упали больно
"Надо похавать мыться и спать.все заибало,для чего блять вообще жить когда у тебя в голове и в сердце полный провал:(","Надо поесть, помыться и спать. Всё надоело, потеряло смысл, потому что в голове и сердце полный провал"
"это пиздец, ребятки=( /","это кошмар , ребятки=( /"
аааааааааааааа( ебать как меня все бесит и все болит ебнвртаааааааааааааа,Как меня всё бесит  и как болит
Пробил в соннике свой сон сегодняшний ебать скоро свадьба ((((,Посмотрел в соннике про свой сегодняшний сон-скоро свадьба
"БОЖЕ, Я НЕ МОГУ БЕЗ НЕГО!( МНЕ БЕЗ НЕГО ПЛОХО( приходится одним ухом слушать этих тупых людишек(","Боже, я не могу без него. Мне без него плохо. Приходится одним ухом слушать этих людей."
"Папа, папа! Ты соврал! Ты говорил годик послушаю эту хуйню и перерасту! Папа, я не перерос((((","Папа, папа! Ты соврал! Ты говорил годик послушаю и перестану! Папа, я не перерос((("
"Бляяя скажите, что я не очень уебански выгляжу в этом платье:((((((","скажите, мне идет это платье"
ну как как блять можно спать до 2 дня??? весь день в жопу((((( п.с.ночь впереди_,"Ну как, блин, можно спать до 2 дня??? Весь день в жопу((( п.с. ночь впереди_"
что за пиздецовый предмет ты сдаешь?(,Что за предмет ты сдаешь?
"Хотя не, мама меня отпиздит, к мене нельзя((","Хотя не, мама будет недовольна, к мене нельзя(("
бляяя... не умею отказывать людям( это самый хуёвый косяк...,Не умею отказывать людям. Это самая плохая черта
бли так хуево вышлия ж пацанам обещала прийти :|,"Блин, плохо вышло, я ж пацанам обещала прийти :|"
"ох Танька муж заревнует, Петя блять, я тебя сегодня все утро искал, пока А.В. Не сказала то что ты улетел, по анг:(","Ох, Таня муж может заревновать. Петя, я тебя всё утро искал, пока А. В. не сказала, что ты улетел"
настроение испортят потом еще на хуй посылают:(,Настроение испортят потом ещё выгоняют
"ну пиздец вы везучие( мы в середине недели в школу, 9(","вы везучие, а мы в середине недели идём в школу"
"что я сделала перед бжд? хорошо выспалась, блять :(",Что я сделала перед БЖД? Хорошо выспалась.
Q: Написать? Я же заебал тебя(  A:,Написать? Я же надоел тебе
"Илюш , прости ...(Я идиотка не дала спать тебе .....Прости ....","Илюш, прости, я не дала спать тебе, прости"
Постебались над мальчиком( сукой себя чувствую,Постебались над мальчиком подлецом себя чувствую.
"бляя, я плачу. ну же, соберись!( тебя вышвырнули - смирись","Я плачу, соберись, тебя выгнали, смирись"
"ну так не иди, че ты как мудак ((((( хз, я сегодня к врачу, но, вангую, все оч плохо","Ну так не иди, чего ты маешься. Хз, я сегодня к врачу , но, вангую, все оч плохо"
Нахуй нужен этот огонь олимпийский в Самаре!!!все дороги перекрыли суки((,Зачем нужен этот огонь олимпийский в Самаре. Все дороги перекрыли.
ебать ну и хуета была а не дискачь(((,Плохо было а не дискачь (((
Юра блять ты вообще умеешь нормально фоткаться (((((,"Юра, ты вообще умеешь нормально фотографироваться?"
"кажется, свой текстик про смерть я уже никогда блядь не найду :(",Кажется свой текст про смерть я уже не найду
А МНЕ ЩАС ПОДАРОК КУПЯТ МНЕ ЕГО ТОЖЕ НЕ НАЙТИ(((,А мне щас подарок купят мне его тоже не найти
пипееец (( опротестовывать не будешь?,Опротестовывать не будешь?
"Блеать, ну ты где???!!!Я уже заебалась ждать (",Ты где? Я устала ждать.
"ТВОЮ МАААААААААААТЬ!!! Я ОТРУБИЛАСЬ ЗА КОМПОМ, А ПРОСНУЛАСЬ ТОЛЬКО СЕЙЧАС......... Я НЕ ЗАКОНЧИЛА ЕЩЕЩ ПЕРЕВОД, НУ БЛИИИИИН!!!!((","Я ОТРУБИЛАСЬ ЗА КОМПОМ, А ПРОСНУЛАСЬ ТОЛЬКО СЕЙЧАС......... Я НЕ ЗАКОНЧИЛА ЕЩЕЩ ПЕРЕВОД!!!(("
"чтобы как чмо ебаное год ходить, а то и больше?((( че-то не хочу","Чтобы как не нормальный год ходить, а то ибольше((( че-то не хочу"
"а у нас все тихо, как в декабре 2008 года( как дкмаешь, в 14-м будет такой же пиздос, как в девятом?(","А у нас все тихо, как декабре 2008 года ( как думаешь, в 14-м будет так же тяжело, как в девятом?"
"Ебать, что с моей челкой? Крысиная грива блин(",что с моей челкой такая некрасивая
"блять, ветеринары дерут в тридорого( ебать, за прием два куска, куда такие деньги???","Ветеринар дорого берут, за приём две тысячи, куда такие деньги???"
"троешник я( физичка сука, засрала меня. мы тест не писали, а за него 2 стоит и пересдать не дала,шлюха:с хуево все крч","Троешник я. Учительница физики помогла в этом. Мы тест не писали, а за него 2 стоит и пересдать не дала. Всё плохо"
Бля ненавижу таких которые прутся и невидят ничего вокруг( а еще мужчинами называются!!!,Не люблю мужчин которые идут и не видят ничего вокруг
Ещё хуже((((  ... Я не понимаю  ФАНЕРА ИСПОРТИЛА ВСЮ РУССКУЮ КУЛЬТУРУ!!!!!!!!!!,Ещё хуже. Я не понимаю фанера испортила всю русскую культуру
ещё и мой верный друг сломался. ну охуеть теперь(,Ещё и мой верный друг сломался. Ну обалдеть теперь
-Позови Димана!-Он с мамой-Сука кидалово((((,-По́зови Димана!-Он с мамой-Кидалово(((
ШО?!ГЕЛА ФОРЕВЕР!!! Я ЛЮБЛЮ ТЕБЯ. НЕ УХОДИ! (((+,"Я люблю тебя, не уходи"
Как я уже заебался сдавать этот ебаный курсач :(,Как я уже устал сдавать этот ужасный курсач
Все заебись только сестренки не хватает((,"Все хорошо,  только сестрёнки не хватает."
