toxic_comment,neutral_comment1
эти твари нам пенсионерам только повышают цену на коммунальные услуги .охуели совсем клопы когда нажрутся,"эти люди нам пенсионерам только повышают цену на коммунальные услуги. совсем обнаглели, никак не успокоятся"
"даааа, время идёт, а идиотов, все больше и больше.....","Даааа, время идёт, а глупых, все больше и больше..."
"а ещё советскую (самую лучшую в мире) школу кончал, дебил!!!",а еще советскую (самую лучшую в мире) школу кончал
"они подлые,паршивые,хитрые,у них полностью отсутствует честь.одним словом бляди.","Хитрые,у них полностью отсутствует честь!"
"представились? спасибо, рады вас видеть, а теперь пиздуйте обратно под шконку.","представились? спасибо, рады вас видеть, а теперь идите обратно."
"мразь ебаная, не ордло, а днр и лнр","Не ордло, а днр и лнр"
"Дебилы бля, гугл на этой хуйне обучает нейросетку для автопилотов",гугл с помощью этой штуки обучает нейросетку для автопилотов
обсерают сидят этих уродов по кайфу вам дебилаи,Оскорбляют сидят всех и им это нравится
"где ж ты, блядь, такая дура то нашлась?????",где ж ты такая нашлась
"сейчас соотношение (зарплата-цена) не адекватно, олигархи жыруют, а пахари сельские в основном хуй сосут.","Сейчас соотношение зарплата-цена не одекватно, олигархи шикуют, а пахари в основном бедствуют"
Рашка таки скатилась в сраное говно,Россия свернула не в ту сторону
"вот таким образом появляются новые законы ,отстреливать как бешеных собак!",вот таким образом появляются новые законы!
"а тогда хрен соси как мишка лапу,честно в нашей стране заработать такие деньги не реально.",Честно в нашей стране заработать такие деньги нереально
"долбоебы!!!я за последний год собрала столько справок,ебнуться можно,ноги до жопы стерла!!!","Я за последний год собрала столько справок,обалдеть,ноги,чуть не до головы стерла.."
таких уродов необходимо уничтожать на месте и не церемониться,Таких людей необходимо наказывать на месте и не церемониться
"сначала хуй предоставьте, а там посмотрим)","Сначала доказательство предоставьте, а там посмотрим)"
То-то столько Сколько? Пукаешь в воздух в попытке оправдать пидорашенскую пиздецовскую реальность - это просто смешно,То-то столько Сколько?Портить воздух в попытке оправдать реальность-это просто смешно
ты только не стони от удовольсвия пидорок..,ты только не стони от удовольствия
эту рыжую крысу чубайса уже давно не видно нигде,этого чубайса уже давно не видно нигде
"ты, чмошница, живи, как хочешь, ебись с кем хочешь, чувырла гребанная! скоро получите, что хотите! вперёд на майдан!!!","Ну и живи, как хочешь, скоро получите, что хотите! Вперёд на майдан!!!"
товарищ задержанный комиссар говорит что депутатская у него неприкосновенность расстрелять и прикасаться не,"Товарищ задержанный комиссар говорит, что депутатская у него неприкосновенность"
"дебилы пишут, только для кого народ и так давно прозрел",Для кого они пишут? Народ и так давно прозрел.
и ихние ублюдки будут прекрасно жить,И ихние потомки будут прекрасно жить
"не надо говорить о себе во множественном числе, чмо не доделанное.",не надо говорить о себе во множественном числе
иди мимо если не нравится хули коментируешь мокрошелка ебучяя,"Иди мимо если не нравится, что комментируешь"
где ты там русских баб то углядела??)))явные корейские пиздоглазки))(,Где ты там русских девушек увидела? Явно корейские
"вообще, сука, очень везучий по жизни знак, что несолько компенсирует постоянное отсутствие у него бабла","вообще очень везучий по жизни знак, что несколько компенсирует отсутствие у него денег"
"сказала охуевшим продавцам, что трахаюсь без гандонов и пошли бы вы со своими масками в очко 😅😅😅","сказала продавцам, что не использую презервативы и маску одевать не буду"
долбаебы наркомана конченного сравнивают с бандитом,наркомана нельзя сравнивать с бандитом
в армейке таких трахали за каждым углом,в армейке над таких постоянно издевались
если не блять то смени фото путний мужик на это не купится,"Если нормальная женщина, то смени фото, путевый мужик на это не купится"
"отсосинка голубкова, ты уже показала какая ты идиотка, может хватит","голубкова, ты уже показала свои способности, может хватит"
что делают деньги? почему сука таких защитников не судят?,Что делают деньги? Почему таких защитников не судят
"Сука, как же я обосрался с этого шерлока, до слёз блять","Как же я удивился с этого шерлока, до слез"
"ты что хохлоблядь не знаешь, что ваша мова это сленг польских холопов","Ты что не знаешь, что ваш язык - это польский сленг"
ты что сука хочешь науськать нашу молодежь на протесты против власти и отправить их на бойню,Ты хочешь нашу молодёжь отправить на протесты против власти?
А мразота продолжает устанавливать свои тоталитарные порядки,власть продолжает устанавливать свои тоталитарные порядки
найти этого мужчину и оторвать ему его потряхушки,Найти этого мужчину и наказать
"читая твои гнусные писульки видно, что ты образован, наверное имеешь высшее образование, а может и не одно","Читая твои записи видно, что ты образован, наверное, имеешь высшее образование, а может и не одно"
"ты же сука видишь что происходит,,, сибирячка,,, хуева",Ты видишь что происходит сибирячка
"ну и нахуя так делать,админ,ты же взрослый чел,убери эту муть, 😆",Зачем так делать администратор убери это
"а значит, тебе, тварь, и возразить то уже нечем",Возразить то уже нечем
"зла блядь не хватает, читая этот бред....","Зла не хватает, читая этот бред"
такие уроды во все времена были не только в путинские,Такие люди во все времена были не только в путинские
А она не с рождения приближается? ЧТО ЗА ХУЙНЯ???,А она не с рождения приближается? Что за ерунда?
долбаебы вы со своими протестами наплачетесь,Вы со своими протестами ещё наплачетесь.
"Пятеро детей, но отец и мать всю жизнь дули в жопу самому младшему","Пятеро детей, но отец и мать всю жизнь любили самого младшего"
вот ребята что делают деньги у негопидора совести не хватает признать себя виноватым трус и подонок,Вот что делают деньги если не хватает совести признать себя виноватым
"интересно дети её знают что её называют соска конченая , проститутка .",интересно дети её знают как её называют
"вы суки, когда уже перестаните этой хуйней заниматься? если денег до хрена отдай ты у кого его нет","вы ,когда уже перестаните этим заниматься? если денег много отдай ты у кого его нет"
и что этого пидора не отпорол никто???,И что его никто не наказал?
"Обратите внимание, какой он ультрабыдлан, в конце говорит: Умываться - для педиков","Обратите внимание, какой он! В конце говорит: умываться не для мужчин"
продажные твари опять хотите в 90-е,Опять хотите в 90-е?
.что вы твари безродные делаете????дак и киев уже переименуйте назовите жопа😡,Что ж вы делаете? И  Киев тогда уже переименуйте!
с этой фразой я стал ненавидеть это хуйло.и как показало время я не ошибся,"После этой фразы я разочаровался в нём. И время показало, что я был прав."
хуй знает что это это долбоеб написал слыхал дзвин а не знает где вин,Незнаю что он написал.слыхал звон да не знает где он
остаётся это дерьмо смыть в унитаз.,Придётся это смыть в унитазе.
А вот и отсылочки к фильмам для дегенератов подъехали,А вот и отсылки к фильмам начались
стыдно за дебилов которые такое придумывают!!!!!!!!,стыдно за таких которые такое придумывают
украинская пидрильно -либеральная схема ..юным добилам на карту по 10 евро за выход на митинг кидают .,Демонстрантам из Украины за выход на митинг платят по 10 евро на карту
"белоручек и долбоёбов, ими легче управлять.","белоручек, ими легче управлять."
"хм, я бы ей маршала дал) а ты соси!)","Я бы ей маршала дал, а тебе нет"
Ну не прямо сразу же ватан бросился к своему кредитному ноутпуку,Не сразу же он бросился к своему ноутбуку
ну не любят в россии пидарасню если,Не любят в России таких людей
что пиздеть то ну видно же что не настоящая,"Что врать то, ну видно же что не настоящаяя"
обосрала машину ещё и наверное шум гам устроила..,Раскритиковала машину ещё и шум устроила
"а что вы раньше не знали, что он алкаш и дерьмо.","А что вы раньше не знали, что у него алкогольная зависимость"
"Этот шакал еще жив? Хуя, года четыре его не видел..",Он еще жив? Четыре года его не видел.
почему эта сволочь до сих пор на свободе...!?,Почему он до сих пор на свободе!?
планирует пригласить к тебе опытного мужчину😂😂😂 писари хуевы,Планирует пригласить к тебе опытного мужчину.
у такого урода рука не дрогнет убить человека,У него рука не дрогнет убить человека
слышь ты алеша хуинная голова пусть девочка работает,"слушай, пусть девочка работает"
"какой по счету ? ты хоть помнишь, сколько км отсосала куёв ?",Какой по счету? Ты хоть помнишь?
"Пойми, пидорюндель, что вы потеряли Украину НАВСЕГДА","Пойми, что вы потеряли Украину навсегда"
"сам ты, бондарь укрожопый, ебанутый, коль уже и написать ничего не можешь, а картинки рассылаешь одни и те же",Коль уже и написать ничего не можешь а картирки рассылаешь однт и те же
"что ты ограничил доступ к прослушиванию, слушай сам в одно рыло мурло","что ты ограничил доступ к прослушиванию, слушай сам наедине с собой"
"Лол чё за херня в комментах, все красаучеги)","Что за ерунда в комментариях, все же красавчики :)"
"вот мрази!!! уже до птиц добрались!!! находить этих выродков, и наказывать по полной!!! быдло!!!😡😡😡",Уже до птиц добрались! Находить их и наказывать по полной!
он не один таких дебилов полон мир.,"Он не один, таких людей полон мир"
"видела какой пидор, хотя бы доехала а так осталась с детьми на трассе","Видела какой человек, хотя бы доехала, а так осталась с детьми на трасе"
"нашёл сука кого пугать..сам то небось в штаны бы наложил от страха, долбоеб😜","Не пугай меня, сам то наверное испугался"
если с сергеем ивановичем что то случится пизда вам блядям,"Если с Сергеем Ивановичем что-то случится, вам будет плохо."
"вот тебе не стыдно, здоровая бабища, а обманываешь людей и зарабатываешь на этом! иди работай лживая тварь!",Тебе не стыдно обманывать людей и зарабатывать на этом? Иди работать
"короновирус не напугал,теперь пугают чумой,ебанутый мозгов палата.","Короновирус не напугал, теперь пугают чумой"
"ты совсем дурачок, хохол? что такое по твоему построенная новая дорога?",что такое по твоему построенная новая дорога?
как же без кавида гребаного!!! мать его дири!!!,Как же без ковида!
"ты целыми днями свою жопу фоткаешь..? крупно завалила ок ими....не пойму,тебя не ебут? или это хобби?",ты целыми днями себя фотографируешь? Это хобби такое?
пидоры проверяют вас на трусливость и рабопоклонение.по маскам видно что рабов и быдла у нас пруд пруди.,проверяют вас на трусливость и покорность.по маскам видно что послушных людей у нас пруд пруди.
савсем твари страх потеряли херли с кабинета не пиздеть с зарплатой за сотку,"Совсем страх потеряли, с кабинета легко говорить с зарплатой за сотку"
на которых все власть имущие положили большой и толстый хуй,На которых все власть имущие наплевали
Тебе в любой теме пиздануть такое надо?,тебе в любой теме такое надо сказать?
"а я бы помогла, твари конченые",А  я бы помогла.
"У тебя Порошенко массовые вбросы на выборах готовит, а ты о москолях думаешь","у тебя порошенка массовые вбросы на выборах готовит, а ты о русских думаешь"
дебилы вам же жить в этом городе,Вам же жить в этом городе
у меня вопрос??? где они такие данные берут???как они задолбали эти пиздаболы!!!!,у меня вопрос??? где они такие данные берут???как они достали
"врач от бога, а законы пишут дебилы.","Врач от бога, а законы пишут неграмотные"
"а этой твари и 5 достаточно,",А ему и 5 достаточно
"ну раз ты не херовый, давай хоть 1 ссылку после которой можно забыл что искал или пиздабол?","Ну тогда давай хоть 1 ссылку, после которой можно забыть, что искал."
"? хуй, залупу ! никто и ни где никому и ничего не дал",никто и ни где никому и ничего не дал
"дура блядь, в такой день и без парашюта",В такой день и без парашюта.
"Ты деньги заплатил ему блять, а то треды он создает здесь","Ты деньги заплатил емк, а то он треды здесь создает."
и эти идиоты его приводят в пример))) =,И эти люди его приводят в пример))) =
"он не виноват! его назначили он насосал , а мы позволили!!! с кого спрос?","Он не виноват! Его назначили,а мы позволили!с кого спрос?"
"Просто мы все наивные дурачки, повелись на образ за которым прятался типичный Ероха.","Просто мы наивные, повелось на образ, за которым прятался Ероха."
самое интересное что пидор получил бесплатное образование от коммуняг и испражняет пакостные идеи вонючим ртом,самое интересное что он получил бесплатное образование от коммунистов и выдаёт пакостные идеи
ды каких нахер националистов? в открытую фашистов тренируют,да каких националистов? в открытую фашистов тренируют
"зомби апокалипсис ! долбаёбы ,в европу собрались????? удачи!!!!!!!!!!!!",зомби апокалипсис ! в европу собрались????? удачи!!!!!!!!!!!!
"у нас в марселе ебануло сожгли конюшни в 8 местах, пидарасы😡",у нас в марселе  сожгли конюшни в 8 местах
мы не ей класс поставим а тебе гандон,"Мы не ей класс поставим, а тебе."
"и что, пойдёшь с придурками малолетники и старыми алкашами против своего верховного главнокомандующего?",Пойдешь с молодежью и стариками против верховнокомандующего?
"на дворе 21 век, а эти пидоры хвалятся прошлым веком",На дворе 21 век а эти люди хвалятся прошлым веком
козлы вы почему не смотрити за своими выблядками,вы почему не смотрити за своими детьми
"а пидор жыд путин то и обнулился , здесь и сейчас","А Путин обнулился,здесь и сейчас"
вот бы ему приставить ко лбу наверное обгадился бы сволочь,"Вот бы ему приставить ко лбу, испугался бы наверное очень!"
"так вот как ты выглядиш , уебище !!!",так вот как ты выглядиш
"пиздешь, неужели не понимает что никто не верят а смеются , ну ебнутая и всё","Вранье. Не ужели не понимает, что никто не верят, а смеются."
не надо всех коммунистов ровнять! у вас в родне и то всяких тварей!!!!!,Не надо всех коммунистов ровнять! У вас в родне кого только нет!
прикинь какую маску надо на это ебло,"Прикинь, какую маску надо на это лицо"
"ой класс,не увидим больше эту хуёвую рожу!","Ой класс, не увидим больше это лицо!"
посмотрим кто кого в рот будет ебат,посмотрим кто кого
"Ты опять выходишь на связь, шизик, тебя уже исключили из твоей сортиростроительной шараги?",Ты опять выходишь на связь? Тебя уже исключили из твоей строительной конторы?
И гитлара и сралина одинаково усатыми жопами считаются,и гитлер и сталин одинаково усатыми лидерами считаются
гои проклятые не надоело вам орать,не надоело вам орать
"нарисуй кентюх какая у тебя пенсия, сколько тебе лет, и кто и сколько платит тебе за эту хуйню!!!","Напиши какая у тебя пенсия, сколько лет, и кто и сколько платит тебе за это"
